{
      "firstName":"Vivek",
      "lastName":"Reddy",
      "hcn":"98765",
      "dob":"2/1/2000",
      "email":"email156@gmail.com",
      "address":"123 streetName",
      "address2":"8",
      "postalCode":"h2k 9p2",
      "city":"Montreal",
      "country":"Canada",
      "serviceType":"Covid-19 vaccin - 2nd dose",
      "location":"Location 1",
      "dateSlot":"2021-06-25",
      "timeSlot":"8:30am - 8:45am"
}